{
  "positive": "Bright cosmetics studio scene, vivid pink and turquoise accents, fresh flowers along the right and bottom edges, clean lighting, minimal empty left area for an advertising headline, product stays in place",
  "negative": "letters, text, watermark, logo, duplicate bottle, clutter, dark scene",
  "prompt_version": "host-authored-bright-flowers-1",
  "source_revision": 1,
  "language": "en"
}
